{
  "envelope_version": "1",
  "intake_id": "sha-256:916f43044196ff165ede8e501b2731d552e9115b9de70549e9c415f449f8478c",
  "kind": "meeting",
  "occurred_at": "2026-01-05T14:00:00Z",
  "captured_at": "2026-01-05T15:02:11Z",
  "source": {
    "system": "example-capture",
    "external_id": "mtg-0001-synthetic"
  },
  "provenance": {
    "adapter": "example-adapter",
    "adapter_version": "0.3.1",
    "acquired_at": "2026-01-05T15:30:00Z",
    "emitted_at": "2026-01-05T15:30:02Z"
  },
  "content": {
    "media_type": "text/vtt; charset=utf-8",
    "byte_length": 66,
    "digest": {
      "algorithm": "sha-256",
      "value": "b6eab61c9bb832090cb36c967ddd4696574e5629ce7b320c4dc42f180331675a"
    }
  },
  "payload": {
    "uri": "example-store:meeting/mtg-0001-synthetic.vtt",
    "preserved_at": "2026-01-05T15:30:01Z"
  },
  "metadata": {
    "title": "Synthetic planning discussion",
    "language": "en-GB",
    "duration_seconds": 2700,
    "participant_count": 4
  }
}
